,DR_NO,Date Rptd,DATE OCC,TIME OCC,AREA,AREA NAME,Rpt Dist No,Part 1-2,Crm Cd,Crm Cd Desc,Mocodes,Vict Age,Vict Sex,Vict Descent,Premis Cd,Premis Desc,Weapon Used Cd,Weapon Desc,Status,Status Desc
644971,230611294,06/17/2023 12:00:00 AM,2023-06-17,1140,6,Hollywood,668,1,442,SHOPLIFTING - PETTY THEFT ($950 & UNDER),1822 0325 2004,0,X,X,203.0,OTHER BUSINESS,,,IC,Invest Cont
644972,230106843,02/12/2023 12:00:00 AM,2023-02-11,1630,1,Central,191,1,440,THEFT PLAIN - PETTY ($950 & UNDER),0913 0344 0603,48,M,H,502.0,"MULTI-UNIT DWELLING (APARTMENT, DUPLEX, ETC)",,,IC,Invest Cont
644973,231515059,09/19/2023 12:00:00 AM,2023-09-19,1030,15,N Hollywood,1549,1,230,"ASSAULT WITH DEADLY WEAPON, AGGRAVATED ASSAULT",1309 0421 0913 0334,36,F,W,101.0,STREET,102.0,HAND GUN,IC,Invest Cont
644974,230110347,04/11/2023 12:00:00 AM,2023-04-10,816,1,Central,192,1,331,THEFT FROM MOTOR VEHICLE - GRAND ($950.01 AND OVER),0344 1822,25,F,H,108.0,PARKING LOT,,,IC,Invest Cont
644975,230618504,12/01/2023 12:00:00 AM,2023-12-01,110,6,Hollywood,639,2,626,INTIMATE PARTNER - SIMPLE ASSAULT,1202 1814 0913 0319 2001 1813 2000 0400 0448,65,F,W,502.0,"MULTI-UNIT DWELLING (APARTMENT, DUPLEX, ETC)",400.0,"STRONG-ARM (HANDS, FIST, FEET OR BODILY FORCE)",AO,Adult Other
644976,242105761,02/13/2024 12:00:00 AM,2023-12-17,730,21,Topanga,2149,1,210,ROBBERY,2000 0913 1814 0344 0329 0400 1414,31,F,H,501.0,SINGLE FAMILY DWELLING,400.0,"STRONG-ARM (HANDS, FIST, FEET OR BODILY FORCE)",AO,Adult Other
644977,230617683,11/10/2023 12:00:00 AM,2023-11-08,800,6,Hollywood,663,2,662,"BUNCO, GRAND THEFT",1501 1900 0701 1822,46,M,H,502.0,"MULTI-UNIT DWELLING (APARTMENT, DUPLEX, ETC)",,,IC,Invest Cont
644978,230511288,07/20/2023 12:00:00 AM,2023-07-20,20,5,Harbor,509,2,901,VIOLATION OF RESTRAINING ORDER,2038 0561,51,M,H,502.0,"MULTI-UNIT DWELLING (APARTMENT, DUPLEX, ETC)",,,AA,Adult Arrest
